{
  "$schema": "https://json-schema.org/draft/2020-12/schema",
  "$id": "https://aoa.local/aoa-memo/mechanics/governance/schemas/governance_memory_writeback_v1.json",
  "title": "Governance Memory Writeback V1",
  "type": "object",
  "additionalProperties": false,
  "required": [
    "authority",
    "created_at",
    "decision_ref",
    "decision_refs",
    "evidence_refs",
    "id",
    "kind",
    "memory_class",
    "notes",
    "schema_version",
    "status"
  ],
  "properties": {
    "authority": {
      "type": "object",
      "additionalProperties": false,
      "required": [
        "actor",
        "mode"
      ],
      "properties": {
        "actor": {
          "type": "string",
          "minLength": 1
        },
        "mode": {
          "type": "string",
          "minLength": 1,
          "enum": [
            "reviewed"
          ]
        }
      }
    },
    "created_at": {
      "type": "string",
      "minLength": 1
    },
    "decision_ref": {
      "type": "string",
      "minLength": 1
    },
    "decision_refs": {
      "type": "array",
      "items": {
        "type": "string",
        "minLength": 1
      }
    },
    "evidence_refs": {
      "type": "array",
      "items": {
        "type": "string",
        "minLength": 1
      },
      "minItems": 1
    },
    "id": {
      "type": "string",
      "minLength": 1
    },
    "kind": {
      "type": "string",
      "minLength": 1,
      "const": "memo.governance_writeback"
    },
    "memory_class": {
      "type": "string",
      "minLength": 1
    },
    "notes": {
      "type": "array",
      "items": {
        "type": "string",
        "minLength": 1
      },
      "minItems": 1
    },
    "schema_version": {
      "type": "string",
      "minLength": 1,
      "const": "v1"
    },
    "status": {
      "type": "string",
      "minLength": 1,
      "enum": [
        "proposed",
        "applied",
        "held",
        "rejected"
      ]
    }
  }
}
