{
  "authority": {
    "actor": "operator.sovereign",
    "mode": "reviewed"
  },
  "created_at": "2026-04-22T12:00:00-06:00",
  "decision_ref": "experience.governance.decision.example.001",
  "decision_refs": [],
  "evidence_refs": [
    "receipt:example:001"
  ],
  "id": "memo.governance_writeback.example.001",
  "kind": "memo.governance_writeback",
  "memory_class": "policy_precedent",
  "notes": [
    "seed example for v0.8 polis governance"
  ],
  "schema_version": "v1",
  "status": "proposed"
}
